{
  "apiVersion": "quickdeploy.ai/v1",
  "kind": "SkillManifest",
  "metadata": {
    "name": "ai.quickdeploy/stripe-payments-operator",
    "version": "0.1.0",
    "title": "Stripe Payments Operator",
    "description": "Sandbox-safe Stripe payments operations with confirm-gated refunds and cancellations.",
    "labels": ["payments", "smb", "stripe"]
  },
  "spec": {
    "source": {
      "type": "file",
      "uri": "skills/quickdeploy/stripe-payments-operator"
    },
    "skill": {
      "name": "stripe-payments-operator",
      "description": "Operate Stripe payments from an agent with sandbox-safe defaults — inspect payments, customers, subscriptions, and webhooks via the Stripe CLI/API, and only touch money-moving operations with explicit confirmation.",
      "license": "MIT",
      "metadata": {
        "ai.quickdeploy.skills/read-only": "false",
        "ai.quickdeploy.skills/sandbox-default": "sandbox",
        "ai.quickdeploy.skills/destructive-ops": "refund-payment,cancel-subscription"
      }
    },
    "safety": {
      "readOnly": false,
      "destructiveOperations": [
        {
          "name": "refund-payment",
          "description": "Creates a full or partial refund against a captured charge.",
          "confirmation": "explicit"
        },
        {
          "name": "cancel-subscription",
          "description": "Cancels a subscription immediately or at period end.",
          "confirmation": "explicit"
        }
      ],
      "sandbox": {
        "supported": true,
        "defaultMode": "sandbox",
        "switchEnvVar": "STRIPE_LIVE_MODE"
      },
      "secretsPolicy": "env-names-only"
    },
    "requirements": {
      "tools": [
        {
          "name": "stripe",
          "kind": "cli",
          "installHint": "https://docs.stripe.com/stripe-cli"
        }
      ],
      "env": [
        {
          "name": "STRIPE_API_KEY",
          "description": "Stripe secret key; test keys (sk_test_*) by default.",
          "required": true,
          "secret": true
        },
        {
          "name": "STRIPE_LIVE_MODE",
          "description": "Set to 1 to explicitly opt into live-mode operations.",
          "required": false,
          "secret": false
        }
      ]
    },
    "references": [
      {
        "path": "references/stripe-cli.md",
        "title": "Stripe CLI reference",
        "purpose": "Command subset for inspection, webhook testing, and confirm-gated writes."
      },
      {
        "path": "references/safety-and-confirmation.md",
        "title": "Safety and confirmation protocol",
        "purpose": "Summarize-then-confirm rules for money-moving operations."
      },
      {
        "path": "references/sandbox-vs-production.md",
        "title": "Sandbox vs production",
        "purpose": "Test-mode defaults and the explicit live-mode opt-in gate."
      }
    ],
    "scripts": [],
    "output": {
      "path": "skills/quickdeploy/stripe-payments-operator"
    }
  }
}
